{"apiVersion":"graphos.io/v1","catalogVersion":1,"entries":[{"artifactCount":8,"bundleDigest":"sha256:20fb3089af5ec4198fa418a4639ceda8a4788ebde4de990ee85711975c828a5a","certificationDigest":"sha256:2af0dd0cc6801d35d6b020dd49389f37b0940f161aad20c9dc0fca16d344e038","connector":"ansible-tower-mcp","manifestDigest":"sha256:3039fa473e5e27e6f84c96ab889c5d93729562dd70d71ef651993bb1ead5a705","sourcePresetCount":2},{"artifactCount":8,"bundleDigest":"sha256:5b30d1c244ee7df401bbd8cce6767f6d9ffbaa9b78f8eccba14131424cd06ef7","certificationDigest":"sha256:a3ac8e549094a40e50772af216865151ab9cd5bbf502b4272481d6bb7348c96e","connector":"archimate-mcp","manifestDigest":"sha256:7a83a63320cabc63ced2e57a6c1145e299f59caea558c48ea54a0be5ab524585","sourcePresetCount":2},{"artifactCount":8,"bundleDigest":"sha256:773719a8908ba0ba369a5ed955ad35050bea5d362627643fcfb7964a083e35ee","certificationDigest":"sha256:37d9cb2630cdb68c90055c4b78d8b457935fd404e0539ef90a186adcd485dd72","connector":"archivebox-api","manifestDigest":"sha256:446888b4e6da157274e3870d9041ac7ee34ec1a39843e30b9f13f962a5c68a6e","sourcePresetCount":1},{"artifactCount":8,"bundleDigest":"sha256:5726e5761c7482168c421b68541116490b59dba550fc2121bef44ee3d8202f8c","certificationDigest":"sha256:d7ac20da854c844a0c61513a00bf0516de7079caa8b4c6f93f1a0a0f2140c545","connector":"aris-mcp","manifestDigest":"sha256:8a831547ccadf002361f2011d138966eae4736297f0638e6d36bc85b2b36033b","sourcePresetCount":1},{"artifactCount":8,"bundleDigest":"sha256:db69913e39a701b8be3cd63254994cb01d970f672391e9e34003a9b3b4a1fcb8","certificationDigest":"sha256:d2a5ff40734c6d7b83f2e134d7d797c42cc1ee02b3355c8cdb2b5e563425fe2c","connector":"arr-mcp","manifestDigest":"sha256:52b91224998232bda867db131582be8e2bee5262a161e084c1a74cfc2af8104a","sourcePresetCount":3},{"artifactCount":8,"bundleDigest":"sha256:927a17a1f06551b6f60a7b0a6ab9c2960073f99e4d55e9065ccd5f1aada3e5db","certificationDigest":"sha256:a0ca10efe88aba2127a54a41cc27ac992d2fed4e40fe87c8cefc1b646e888274","connector":"atlassian-agent","manifestDigest":"sha256:a7515b06c290140d3f63d75d8bd67e0c9ccc7c5f3ccc073ec649d8639c5f1984","sourcePresetCount":2},{"artifactCount":8,"bundleDigest":"sha256:951af3a1f1ea4f5d8b32920fcbed85c71edeb4527e3dc6b188c20274797a32e2","certificationDigest":"sha256:51675ccfbda75eca9bd544d2b1dc92f6977c49d20c2fb5e17917c3224b2e4ecf","connector":"audio-transcriber","manifestDigest":"sha256:ea9407c6454c574cdba2b548a4dba2b917ec4e2c06b7b0a4c52c5f420adf411e","sourcePresetCount":1},{"artifactCount":8,"bundleDigest":"sha256:a9bd3b9cceec3b515f0d4d3786b97267bdece1bf12883d564192717f9fdc30af","certificationDigest":"sha256:6cfe3fe5c1b316088e1701ff6951123351c6420f5d882332e990d70a5fb47206","connector":"audiobookshelf-mcp","manifestDigest":"sha256:f5ef9a544294a26b01a156060e35aab12cca1fb13266314573b965ab28e07356","sourcePresetCount":1},{"artifactCount":8,"bundleDigest":"sha256:a0ca040762dc93d06610f15be626f6c12c6ac2e5700619fe42f10f72ed7eb3a8","certificationDigest":"sha256:e0e200d7f014b732a97e7be911f3ff62c986f6455b1a1369a6f3107c26133f71","connector":"caddy-mcp","manifestDigest":"sha256:7c18e09ea9a51c4acdd50a83b69af37bec6c3b5fd816d60418bb3f61a7c93ef7","sourcePresetCount":1},{"artifactCount":8,"bundleDigest":"sha256:bc4cfa70797b68e8edbd36ce5e86dde4339654fdf0c4f6a403108ea63845aedf","certificationDigest":"sha256:f92dc05dd6d05ec15971fab7022287d42c992ac888cf30f7e07ed68d6223ef3f","connector":"camunda-mcp","manifestDigest":"sha256:f8b13c8688d73e8633ef54db2ad6d40670b59cbf1f8526a72dd600c3a1533673","sourcePresetCount":1},{"artifactCount":8,"bundleDigest":"sha256:7db739474b2c7122d6d1a6d625e30f7cdf5e6f5d87bcd1b0e2745e204f066a5d","certificationDigest":"sha256:7b5206c8732078d823e843966293fd27a5b52dbd62425fc604a9c9711719da15","connector":"ciso-assistant-api","manifestDigest":"sha256:10109481d49c77de2eba572d5c029e9ac5446feac96a6e91abf9c79b3011cd30","sourcePresetCount":2},{"artifactCount":8,"bundleDigest":"sha256:a10d44c1411ca33106a231cd74a9bd0fcebe9f726cc9862f0fb08f01e08c6559","certificationDigest":"sha256:91c5e532b62a3f8adc6721ac64499ed485ddf81fa830a129a27bbfa8c06a8126","connector":"clarity-api","manifestDigest":"sha256:6fbf1f194f021f559db30d1beae00ceda708f02672745f4a1b6af377e513eb0f","sourcePresetCount":1},{"artifactCount":8,"bundleDigest":"sha256:bfcaa56405ce051c1d27cedb7aa42ae2ed9ed9e2e0cbf68f35c9ada8f6fc313b","certificationDigest":"sha256:fd52f070c3a0dfdf7020f6527adf688953a42390bac05bcd4d0e9d6d012b15a1","connector":"container-manager-mcp","manifestDigest":"sha256:1eee3458a3fb38b25ba0ac416e8a0094996ee905441b8f7d5ec36f8b3c9548d5","sourcePresetCount":6},{"artifactCount":8,"bundleDigest":"sha256:9cdca5dc4b762e871c8eb949bcea628082300d9365710f21ea2e04963d474c89","certificationDigest":"sha256:3c0778c8ec7c4c74e2a17806bc15c826d5ac33ef18c473e7d89a8fe2121c8d86","connector":"data-science-mcp","manifestDigest":"sha256:14f8469926d618ce64ead5f174d1fe08cb7a36e7f8cc64c3a1fca885ccc3a869","sourcePresetCount":1},{"artifactCount":8,"bundleDigest":"sha256:f291ac8fc698a8a2e8a5144ec5365bf27e653616405c69ee9418c5c868b0732a","certificationDigest":"sha256:52666d5c26519d191c9af804e6994461c93ed2c7b7a2bc43067aa841ceace8f9","connector":"dockerhub-api","manifestDigest":"sha256:26438e10c1baaa262e36eb33b2e4875d75779df224fbfe6af4e4d1d11a21cc0a","sourcePresetCount":1},{"artifactCount":8,"bundleDigest":"sha256:c575b488ca65a01962bbf1b38776ee895443191e6d0ac59fac9ef499fce3aada","certificationDigest":"sha256:aaf6e87cd8629ccbb1f5c487be7a60a85bf40b4f7571265e59f19fc91d697f87","connector":"documentdb-mcp","manifestDigest":"sha256:90daca0d8ef2077d8907ba58cd1643152f22919a47b324059e582f92651cbdce","sourcePresetCount":1},{"artifactCount":8,"bundleDigest":"sha256:64c040e5d5cf5f42c433ec2a7f64c711b9726e3dfb5d8616715cbb4f1930dc9c","certificationDigest":"sha256:87419d6602f10a37b426b7dc953f4b77b42f9d7f54401872f01c6963f11f2306","connector":"egeria-mcp","manifestDigest":"sha256:78f84f185cca236d9eb45cc59b583127285399646befe7531e47fd64d458f699","sourcePresetCount":2},{"artifactCount":11,"bundleDigest":"sha256:5aad6ce4c8e9103261adc2b71fcf0ee2461c9db5da7d7dab438b4b5beaac5270","certificationDigest":"sha256:2daba134727d30b9266a9489f970c9eecd037315145abd8590369a678c9c384e","connector":"emerald-exchange","manifestDigest":"sha256:fd48fc42aa199ba2bd495c569f50fb4a63dc4a93b9b71ebe3e861885487a8909","sourcePresetCount":1},{"artifactCount":8,"bundleDigest":"sha256:ac7e5935be663c6307e9ef75228bec7c4466d93a006c14f5c0236f186a6cfbcf","certificationDigest":"sha256:ce3f57a58689b18694e2f08211761c1a778cf0cda897a222345a749dec981336","connector":"erpnext-agent","manifestDigest":"sha256:52aa9bb9a22ca1ee5d7b968d44ebf413c2a48235561c355da5cb8317242e5ec8","sourcePresetCount":2},{"artifactCount":8,"bundleDigest":"sha256:9d48acea31cdd48794d4926ef4f3c7dcb36e03451a223b53baf1a3c49d456532","certificationDigest":"sha256:1d2ca36de1efda76f2278926d04c39ca36e3a8e19288de30e2f06a2ea410659e","connector":"fan-manager","manifestDigest":"sha256:e58e827cab300a51c2dcc8edcab5649e2f29b7dc52950d443c5fff86bf625063","sourcePresetCount":1},{"artifactCount":8,"bundleDigest":"sha256:a5f8937a7c4e7da9cfb89e24bec0d2ad798c2a73829cc25c3d217826f40d0ccf","certificationDigest":"sha256:e232d492d674ca56d21e42b4ba234b6e7b966695a3a8a9d0b713e032c432ab12","connector":"firefly-iii-mcp","manifestDigest":"sha256:aafe363bb2731b3264e595ccf06209d04dc130029be3e0abc64d68cf207fc876","sourcePresetCount":3},{"artifactCount":8,"bundleDigest":"sha256:1309e6b4f6390c5394c79ae810f91418130c4d271acb0aad9dab249ba438619e","certificationDigest":"sha256:bb6d63205fbce2c4d4e8fb151632916654cb62b6a3a50a6605a3a7978bb6f4fa","connector":"freshrss-agent","manifestDigest":"sha256:23642e39a862e72310b9a2a4bd3b7fe268798fe9bc90e998addda60f2e2e83bf","sourcePresetCount":1},{"artifactCount":8,"bundleDigest":"sha256:e38331ce4127c24233fb763fe0815189c820f8941339a680d546dd58447a60a5","certificationDigest":"sha256:36f9a062cc7396215e15af508127f7bac2a9acf21f4e952f34e38c96c9d18a27","connector":"genius-agent","manifestDigest":"sha256:b16cda699d77b44fe3a4dc7e0b7215ec8bc64a884d3c70924100cf50ed989735","sourcePresetCount":1},{"artifactCount":8,"bundleDigest":"sha256:ee407fedb32675a5417b4354a6125ce5ebebd0448c31b9ea78cb477f53688fce","certificationDigest":"sha256:2f0c17b493614fc46ae20061cc904d466999c61b68d891bb1c900ba6852d4fd0","connector":"github-agent","manifestDigest":"sha256:6623b7cb91f43491ee013b45588c98a5dddd975568469541b5e81a3393448c6d","sourcePresetCount":1},{"artifactCount":8,"bundleDigest":"sha256:c3e9f2a480054da757950eabc74154d00cfe5fc884a4a1609848a95b82d28eb6","certificationDigest":"sha256:6a382d8d95a196f9cc3d1a35e89020d1a2d1367765885c1a3874838b55800fd9","connector":"gitlab-api","manifestDigest":"sha256:a54aac9929e2f281fc34b5e87c3224b60bad4ef2e5d5556a868bf3dc8d2198af","sourcePresetCount":1},{"artifactCount":8,"bundleDigest":"sha256:dc343189817c721d8c62d1de5863bd090201337d389609e7b5501b99ab4576a5","certificationDigest":"sha256:14668d04134491b958b7ae569467bfe52380007b16d6f961869e9be4086e4d01","connector":"gramps-mcp","manifestDigest":"sha256:c24d8948f729b83adc8fb121abd45f13d54e8afa0841a76b34bd0cbf5be275b6","sourcePresetCount":3},{"artifactCount":8,"bundleDigest":"sha256:93f29b3791118f1a8e2bcd9282950dc168d9a9b5b18df1f5fdd77f86452785a8","certificationDigest":"sha256:0f73a756a653b23f2992fbf70bf7569af4f92cfbdd99fe8068edf9901601ac27","connector":"hdhomerun-mcp","manifestDigest":"sha256:f781447b904f3ab284e605b8256d4b970b4abce7301b2d0eefd4c8ff2421ada7","sourcePresetCount":2},{"artifactCount":8,"bundleDigest":"sha256:88071094f8efd1448d6285518d054edc22877370997e7a86c173e98e213759fd","certificationDigest":"sha256:988b9ab5a2726929858b24922421460d2e3f73324d0e00d82c86613c4f58f3dd","connector":"home-assistant-agent","manifestDigest":"sha256:4c108d8c677078ce77ac908d3e2114794e34c045d88edae9fde344c022c0ba3e","sourcePresetCount":1},{"artifactCount":8,"bundleDigest":"sha256:aaa9ef4cda4f9e472faeff32b9753177854de0d9220b4e6802cd3bb20cff30d9","certificationDigest":"sha256:70a14ca0ec0a3a7e63517089f872895eff7eaa64659577c35e8c66add1210c95","connector":"jellyfin-mcp","manif